{
  "$schema": "http://json-schema.org/schema",
  "title": "Angular Extra Build Cli Schema",
  "type": "object",
  "properties": {
    "$schema": {
      "type": "string"
    },
    "base": {
      "description": "The base configurations",
      "type": "object",
      "properties": {
        "outDir": {
          "type": "string",
          "default": "dist",
          "description": "The output directory for build results."
        }
      }
    },
    "copy": {
      "description": "Copy configurations (just support file)",
      "type": "array",
      "items": {
        "description": "(Array-Item) Copy configurations",
        "type": "object",
        "properties": {
          "from": {
            "type": "string",
            "description": "Source file of be copied"
          },
          "to": {
            "type": "string",
            "description": "Destination file of be copied"
          }
        },
        "required": [
          "from",
          "to"
        ]
      }
    },
    "css": {
      "description": "Css compiler options",
      "type": "object",
      "properties": {
        "from": {
          "type": "string",
          "description": "Source file to be compiled"
        },
        "to": {
          "type": "string",
          "description": "Destination file of the compiled operation"
        },
        "devUrl": {
          "type": "string",
          "description": "The css link in tag <link> in index.html for the development"
        }
      },
      "required": [
        "from",
        "to"
      ]
    },
    "i18n": {
      "description": "Build options for i18n file(s)",
      "type": "object",
      "properties": {
        "source": {
          "type": "string",
          "description": "Directory of source i18n file(s)"
        },
        "extra": {
          "type": "string",
          "description": "Directory of extra i18n file(s)"
        },
        "target": {
          "type": "string",
          "description": "Directory of target i18n file(s)"
        }
      },
      "required": [
        "source",
        "target",
        "extra"
      ]
    },
    "replacement": {
      "description": "",
      "type": "array",
      "items": {
        "description": "Replacement configurations",
        "type": "object",
        "properties": {
          "file": {
            "type": "string",
            "description": "The file (path) you want to execute the replacement"
          },
          "contents": {
            "type": "array",
            "description": "(Array) Contents you want to replace to and be replaced",
            "items": {
              "type": "object",
              "description": "(Array-Item) Contents you want to replace to and be replaced",
              "properties": {
                "replace": {
                  "type": "string",
                  "description": "Contents you want to be replaced"
                },
                "with": {
                  "type": "string",
                  "description": "Contents you want to replace to"
                },
                "withEnv": {
                  "type": "object",
                  "description": "Environment name and corresponding contents you want to replace to in a particular environment"
                }
              },
              "required": [
                "replace"
              ]
            }
          }
        },
        "required": [
          "file",
          "contents"
        ]
      }
    },
    "deletion": {
      "type": "array",
      "description": "(Array) Files or directorys you want to delete",
      "items": {
        "type": "string",
        "description": "(Array-item) File or directory you want to delete"
      }
    },
    "compression": {
      "type": "object",
      "description": "Compression configurations",
      "properties": {
        "extension": {
          "description": "Extension of the compressed file",
          "type": "string",
          "default": "zip",
          "enum": [
            "zip",
            "tar",
            "gz"
          ]
        },
        "from": {
          "type": "string",
          "description": "Prepare compressed directory"
        },
        "to": {
          "type": "string",
          "description": "Compressed file"
        }
      },
      "required": [
        "from",
        "to"
      ]
    }
  }
}
